{
  "contract": "helianthus.platform.draft-candidate-fact-public-status.v1",
  "schema_version": 1,
  "export_tier": "PUBLIC_REDACTED",
  "projection_id": "dcfpsv1:sha256:856cc167c33cad57c6b761fb82fe1e8872966bcc813a0f64c6b54b7b2dd7cfa8",
  "projection_hash": "sha256:856cc167c33cad57c6b761fb82fe1e8872966bcc813a0f64c6b54b7b2dd7cfa8",
  "source_commit": "8bcba2107d10b149f984ac9546ea6427a9cda8a1",
  "docs_source_commit": "35d2eba256a77b6575a2b45c07e73f054ff74ced",
  "source_graph_id": "dcfgv1:sha256:a7e4e661b2b78b37ff60f6f5c5b419d9af1cdf1b0f0570a9168b3ecbd3f99be9",
  "source_graph_hash": "sha256:a7e4e661b2b78b37ff60f6f5c5b419d9af1cdf1b0f0570a9168b3ecbd3f99be9",
  "source_replay_id": "dcfrv1:sha256:3690beebdd13cb0109c2662f070edeee52906fd79c2ce44cb6e850361b82dc55",
  "source_replay_hash": "sha256:3690beebdd13cb0109c2662f070edeee52906fd79c2ce44cb6e850361b82dc55",
  "fact_count": 18,
  "status_counts": {"RAW_ONLY": 14, "WITHHELD": 4},
  "facts": [
    {"candidate_id": "m7-candidate-0001", "status": "WITHHELD", "terminal_negative_state": "CLOUD_ONLY", "fact_hash": "sha256:867157d98ac046e6bc09ae60b4a963e5f7c6d174f12d293b09cc339c7f9dd9a2"},
    {"candidate_id": "m7-candidate-0002", "status": "WITHHELD", "terminal_negative_state": "NOT_TESTED", "fact_hash": "sha256:26df8fd76d3d2804c899a063766075a9cad25ad90cccfcde067c10b95cb793be"},
    {"candidate_id": "m7-candidate-0003", "status": "WITHHELD", "terminal_negative_state": "NOT_TESTED", "fact_hash": "sha256:4f64a3fb317dee55c8838b2f5406976e3ba6e24f1c977cb141a0e1c1ed300911"},
    {"candidate_id": "m7-candidate-0004", "status": "WITHHELD", "terminal_negative_state": "NOT_TESTED", "fact_hash": "sha256:aae4e6db120c3ac922e9c981fd80041388c2e17cb099eadcddb34e61008e3490"},
    {"candidate_id": "m7-candidate-0005", "status": "RAW_ONLY", "terminal_negative_state": null, "fact_hash": "sha256:8977e5c07fd85b6426bb33339f4ea6611d6b30a2fbe8085c86af4af9ee348e68"},
    {"candidate_id": "m7-candidate-0006", "status": "RAW_ONLY", "terminal_negative_state": null, "fact_hash": "sha256:9b41084d9dff93c429868ba10070a25ef13f2bf8e516f3a1041cc93e4208d716"},
    {"candidate_id": "m7-candidate-0007", "status": "RAW_ONLY", "terminal_negative_state": null, "fact_hash": "sha256:0bbde5749d3898aa8fae6728f57151c760301aad3a81ac0788ab4f4089f80ab1"},
    {"candidate_id": "m7-candidate-0008", "status": "RAW_ONLY", "terminal_negative_state": null, "fact_hash": "sha256:9391dfaf024f5d0f4077cde3432f2a49ea369c671ca8ea8488b9a1231481e5b9"},
    {"candidate_id": "m7-candidate-0009", "status": "RAW_ONLY", "terminal_negative_state": null, "fact_hash": "sha256:b877ec270984317b55bff9a6b26af05e9e5eabf4fd51884e9d19f64828b3f2a1"},
    {"candidate_id": "m7-candidate-0010", "status": "RAW_ONLY", "terminal_negative_state": null, "fact_hash": "sha256:acdcb9c06d0568e0f6c5878821400a18d5210782652e0d005a5f696687911ad7"},
    {"candidate_id": "m7-candidate-0011", "status": "RAW_ONLY", "terminal_negative_state": null, "fact_hash": "sha256:07ea12e4df387e2c4eb00e310538753a52767a47527d1c8ad2294447f7c945ce"},
    {"candidate_id": "m7-candidate-0012", "status": "RAW_ONLY", "terminal_negative_state": null, "fact_hash": "sha256:b4358e7b5151be311c7b72e118d742dbb1357d87f217edc515428a3c096c6cf9"},
    {"candidate_id": "m7-candidate-0013", "status": "RAW_ONLY", "terminal_negative_state": null, "fact_hash": "sha256:e095c1ad351cd414073c64f3dcdc26dce9f00996f3b8e3d99edca222a501e4a8"},
    {"candidate_id": "m7-candidate-0014", "status": "RAW_ONLY", "terminal_negative_state": null, "fact_hash": "sha256:d3e51eee701c7fff70c0ede8b32feef9a38da210617e2a68fd5798b530d91937"},
    {"candidate_id": "m7-candidate-0015", "status": "RAW_ONLY", "terminal_negative_state": null, "fact_hash": "sha256:567520ac201f64d760bdbb07b652a2c5706a1461ac89cf56640a381a0c80a5bd"},
    {"candidate_id": "m7-candidate-0016", "status": "RAW_ONLY", "terminal_negative_state": null, "fact_hash": "sha256:f80be3d32ad388851a2228a887ed565a3d5044c6ab88447a9d438e3f747e9d09"},
    {"candidate_id": "m7-candidate-0017", "status": "RAW_ONLY", "terminal_negative_state": null, "fact_hash": "sha256:dfcd78c2bc137e3a2d46e54980bbcc308554b35b34cae70cbb7a363e5ae4c90b"},
    {"candidate_id": "m7-candidate-0018", "status": "RAW_ONLY", "terminal_negative_state": null, "fact_hash": "sha256:8ebbdf6de4d22927092ae9697095fc354a0f4a7111c356ac2c35aa312115b7d6"}
  ]
}
